{
  "files": [
    {
      "path": "README.md",
      "sha256": "f9f1e5c5083a1ca99aad6bf4fcaf16f896c4af28db668888b4fe005f6a3c58fd"
    },
    {
      "path": "plugin.yaml",
      "sha256": "34dd53465527c9441d88d40ed9c30c8dcc3a50ff2d913ede9f54b066dbc1f7de"
    },
    {
      "path": "runtime/__init__.py",
      "sha256": "65e9c384820cfa7e94594fee0b4e1f18f9b24590a8e16b20aba8c436ee09fa76"
    },
    {
      "path": "runtime/__main__.py",
      "sha256": "833fea954a5f5c1e417d5dcff7a83a4e03cf5181546b8e0868ab35da6cbdb924"
    },
    {
      "path": "skills/placeholder/SKILL.md",
      "sha256": "2b86c1bb5947c064e0e71b603bf43e8a46340af1c94c2f2c81be91f46ee6a6b3"
    },
    {
      "path": "skills/placeholder/assets/README.md",
      "sha256": "a0a8c61beebcca6734afaf6d690e18bc4e4cc96b79f0aed147fafa009b02fd15"
    },
    {
      "path": "skills/placeholder/binding.yaml",
      "sha256": "504a868a3140d2d331e3d1b3dd52ea95c6ac9e09cffba9d6c5d67d162e0da219"
    },
    {
      "path": "skills/placeholder/references/README.md",
      "sha256": "03b64e5707e6ca2827cd5abaf01c7238a960228bbba075c36717583d0e8c936b"
    },
    {
      "path": "skills/placeholder/schemas/input.json",
      "sha256": "6c91f8788da870e6297075856d36d69a93e043328d8f5982354af4e48093ea24"
    },
    {
      "path": "skills/placeholder/schemas/output.json",
      "sha256": "c442ac6d5ca971089a5a5e10d6b876f68fe3a2729e0541dd19dfecf02eacdb0c"
    },
    {
      "path": "skills/placeholder/scripts/README.md",
      "sha256": "ae5e57d045db9f29e45370d663f729d75b50a4539b86d64ba75d84f2f504bf8e"
    }
  ],
  "lockVersion": 1,
  "package": {
    "id": "local.placeholder",
    "protocol": "edgecitadel.managed-agent.v1",
    "version": "0.2.0"
  },
  "skills": [
    {
      "contentSha256": "2b86c1bb5947c064e0e71b603bf43e8a46340af1c94c2f2c81be91f46ee6a6b3",
      "name": "placeholder",
      "skillId": "example.placeholder",
      "version": "0.1.0"
    }
  ]
}
